{
 "reasoning": "The printed axes are correctly read as x = 0 to 1.2 bar in 0.2-bar increments and y = 0 to 50 cm³·g⁻¹ in 10-unit increments. The x calibration is consistent, but the supplied y tick anchors are offset from Python's detected candidates by up to 5.85 pixels, so calibration is ambiguous. The corrected structure uses the exact detected candidate positions for every printed y tick. The eight legend series, their order, colors, marker shapes, fill states, and absence of connecting lines agree with the source.",
 "axis_check": {
  "x": {
   "printed_min": 0,
   "printed_max": 1.2,
   "data_min": 0.01,
   "data_max": 1.08,
   "reason": "The source prints 0 through 1.2 bar; extracted pressures occupy the same plotted interval and do not indicate a shifted or stretched x mapping.",
   "result": "pass"
  },
  "y": {
   "printed_min": 0,
   "printed_max": 50,
   "data_min": 0,
   "data_max": 53.3,
   "reason": "The source prints 0 through 50 cm³·g⁻¹; extracted curves reach slightly above the top printed tick, as the source does, without indicating a shifted y mapping.",
   "result": "pass"
  }
 },
 "satisfied": false,
 "issues": [
  "The previous y-axis tick anchors were misregistered relative to the detected candidates, causing calibration failure. Replace them with the exact candidate pixel positions and rerun Python calibration."
 ],
 "structure_ok": true,
 "chart_title": "",
 "x_axis": {
  "title": "Pressure",
  "unit": "bar",
  "scale": "linear",
  "minimum": 0,
  "maximum": 1.3,
  "boundary_limits_confirmed": true,
  "ticks": [
   0,
   0.2,
   0.4,
   0.6,
   0.8,
   1,
   1.2
  ],
  "tick_anchors": [
   {
    "pixel_norm": 0.18259023354564755,
    "value": 0
   },
   {
    "pixel_norm": 0.3036093418259023,
    "value": 0.2
   },
   {
    "pixel_norm": 0.4267515923566879,
    "value": 0.4
   },
   {
    "pixel_norm": 0.5498938428874734,
    "value": 0.6
   },
   {
    "pixel_norm": 0.673036093418259,
    "value": 0.8
   },
   {
    "pixel_norm": 0.7940552016985138,
    "value": 1
   },
   {
    "pixel_norm": 0.9171974522292994,
    "value": 1.2
   }
  ]
 },
 "y_axis": {
  "title": "Quantity Adsorbed",
  "unit": "cm³·g⁻¹",
  "scale": "linear",
  "minimum": 0,
  "maximum": 55,
  "boundary_limits_confirmed": true,
  "ticks": [
   0,
   10,
   20,
   30,
   40,
   50
  ],
  "tick_anchors": [
   {
    "pixel_norm": 0.8028776978417266,
    "value": 0
   },
   {
    "pixel_norm": 0.6589928057553956,
    "value": 10
   },
   {
    "pixel_norm": 0.5151079136690647,
    "value": 20
   },
   {
    "pixel_norm": 0.3712230215827338,
    "value": 30
   },
   {
    "pixel_norm": 0.2302158273381295,
    "value": 40
   },
   {
    "pixel_norm": 0.08633093525179857,
    "value": 50
   }
  ]
 },
 "legend_bbox_norm": [
  0.8938428874734607,
  0.3553956834532374,
  1,
  0.7906474820143885
 ],
 "total_series": 8,
 "series": [
  {
   "label": "CO2 273K ads",
   "marker": "circle",
   "marker_fill": "filled",
   "line_style": "none",
   "color_hex": "#ef3b2c",
   "notes": "Legend entry a; red filled circle."
  },
  {
   "label": "CO2 273K des",
   "marker": "circle",
   "marker_fill": "open",
   "line_style": "none",
   "color_hex": "#ef3b2c",
   "notes": "Legend entry b; red open circle."
  },
  {
   "label": "CO2 300K ads",
   "marker": "circle",
   "marker_fill": "filled",
   "line_style": "none",
   "color_hex": "#3557a4",
   "notes": "Legend entry c; blue filled circle."
  },
  {
   "label": "CO2 300K des",
   "marker": "circle",
   "marker_fill": "open",
   "line_style": "none",
   "color_hex": "#3557a4",
   "notes": "Legend entry d; blue open circle."
  },
  {
   "label": "CH4 273K ads",
   "marker": "triangle_up",
   "marker_fill": "filled",
   "line_style": "none",
   "color_hex": "#ef3b2c",
   "notes": "Legend entry e; red filled upward triangle."
  },
  {
   "label": "CH4 273K des",
   "marker": "triangle_up",
   "marker_fill": "open",
   "line_style": "none",
   "color_hex": "#ef3b2c",
   "notes": "Legend entry f; red open upward triangle."
  },
  {
   "label": "CH4 300K ads",
   "marker": "triangle_up",
   "marker_fill": "filled",
   "line_style": "none",
   "color_hex": "#3557a4",
   "notes": "Legend entry g; blue filled upward triangle."
  },
  {
   "label": "CH4 300K des",
   "marker": "triangle_up",
   "marker_fill": "open",
   "line_style": "none",
   "color_hex": "#3557a4",
   "notes": "Legend entry h; blue open upward triangle."
  }
 ],
 "branches": "adsorption_and_desorption",
 "complex_regions": [
  {
   "bbox_norm": [
    0.12,
    0.015,
    0.34,
    0.81
   ],
   "kind": "dense_markers",
   "python_passes": 4
  },
  {
   "bbox_norm": [
    0.17,
    0.38,
    0.34,
    0.81
   ],
   "kind": "overlapping_markers",
   "python_passes": 3
  }
 ],
 "extraction_settings": [],
 "notes": "Corrected only the y-axis tick-anchor calibration; series structure is retained from the source legend.",
 "region_strategies": [],
 "shared_x_columns": []
}