{
 "reasoning": "Python produced no extraction because it failed to detect the axis frame. The source has a linear pressure axis from 0 to 1200 mbar, with labeled major ticks at 0, 400, 800, and 1200 and shorter intervening ticks. The y axis is linear from 0 to 3.0 mmol/g in 0.5 increments. The six legend entries are correct in order, but the plotted series use solid connecting lines, and the 373K glyph is a plus rather than a star.",
 "axis_check": {
  "x": {
   "printed_min": 0,
   "printed_max": 1200,
   "data_min": null,
   "data_max": null,
   "reason": "The source pressure axis reads 0, 400, 800, and 1200 mbar; no extracted values were produced this round, so the data range is unavailable.",
   "result": "pass"
  },
  "y": {
   "printed_min": 0,
   "printed_max": 3,
   "data_min": null,
   "data_max": null,
   "reason": "The source loading axis reads 0 through 3.0 mmol/g in 0.5 increments; no extracted values were produced this round, so the data range is unavailable.",
   "result": "pass"
  }
 },
 "satisfied": false,
 "issues": [
  "Axis-frame detection failed, so Python returned no markers.",
  "All six plotted series have solid connecting curves, not line_style none.",
  "The CO2 373K legend and plot marker is a plus, not a star."
 ],
 "structure_ok": true,
 "chart_title": "",
 "x_axis": {
  "title": "P",
  "unit": "mbar",
  "scale": "linear",
  "minimum": 0,
  "maximum": 1200,
  "boundary_limits_confirmed": false,
  "ticks": [
   0,
   400,
   800,
   1200
  ],
  "tick_anchors": [
   {
    "pixel_norm": 0.23219,
    "value": 0
   },
   {
    "pixel_norm": 0.46174,
    "value": 400
   },
   {
    "pixel_norm": 0.69129,
    "value": 800
   },
   {
    "pixel_norm": 0.92084,
    "value": 1200
   }
  ]
 },
 "y_axis": {
  "title": "CO2 Loading",
  "unit": "mmol/g",
  "scale": "linear",
  "minimum": 0,
  "maximum": 3,
  "boundary_limits_confirmed": false,
  "ticks": [
   0,
   0.5,
   1,
   1.5,
   2,
   2.5,
   3
  ],
  "tick_anchors": [
   {
    "pixel_norm": 0.94352,
    "value": 0
   },
   {
    "pixel_norm": 0.81728,
    "value": 0.5
   },
   {
    "pixel_norm": 0.69103,
    "value": 1
   },
   {
    "pixel_norm": 0.56478,
    "value": 1.5
   },
   {
    "pixel_norm": 0.43854,
    "value": 2
   },
   {
    "pixel_norm": 0.3123,
    "value": 2.5
   },
   {
    "pixel_norm": 0.18605,
    "value": 3
   }
  ]
 },
 "legend_bbox_norm": [
  0.55673,
  0.69103,
  0.91425,
  0.93189
 ],
 "total_series": 6,
 "series": [
  {
   "label": "CO2 303K",
   "marker": "circle",
   "marker_fill": "filled",
   "line_style": "solid",
   "color_hex": "#e5252a",
   "notes": "Red filled circles with solid connecting curve."
  },
  {
   "label": "CO2 313K",
   "marker": "square",
   "marker_fill": "filled",
   "line_style": "solid",
   "color_hex": "#f2a51a",
   "notes": "Orange filled squares with solid connecting curve."
  },
  {
   "label": "CO2 323K",
   "marker": "triangle_up",
   "marker_fill": "filled",
   "line_style": "solid",
   "color_hex": "#168c48",
   "notes": "Green filled upward triangles with solid connecting curve."
  },
  {
   "label": "CO2 333K",
   "marker": "hexagon",
   "marker_fill": "filled",
   "line_style": "solid",
   "color_hex": "#29489a",
   "notes": "Blue filled hexagons with solid connecting curve."
  },
  {
   "label": "CO2 353K",
   "marker": "diamond",
   "marker_fill": "filled",
   "line_style": "solid",
   "color_hex": "#c52d8d",
   "notes": "Magenta filled diamonds with solid connecting curve."
  },
  {
   "label": "CO2 373K",
   "marker": "plus",
   "marker_fill": "filled",
   "line_style": "solid",
   "color_hex": "#050505",
   "notes": "Black plus markers with solid connecting curve."
  }
 ],
 "branches": "adsorption_only",
 "complex_regions": [
  {
   "bbox_norm": [
    0.23219,
    0.18605,
    0.92084,
    0.94352
   ],
   "kind": "thick_connecting_lines",
   "python_passes": 2
  },
  {
   "bbox_norm": [
    0.23219,
    0.7608,
    0.4103,
    0.94352
   ],
   "kind": "dense_markers",
   "python_passes": 2
  }
 ],
 "extraction_settings": [],
 "notes": "The plot contains six adsorption isotherms. The frame coincides with the outer 0 and 1200 mbar and 0 and 3.0 mmol/g ticks; the outer limits therefore are not confirmed beyond the printed ticks.",
 "region_strategies": [],
 "shared_x_columns": []
}